AED設置場所名称,よみ,住所,経度,緯度,利用開始時間,利用終了時間,設置位置,注意事項,URL,備考
田辺小学校,たなべしょうがっこう,京田辺市田辺鳥本１０２,135.7702725,34.81700754,,,職員室,,,
薪小学校,たきぎしょうがっこう,京田辺市薪堀切谷１,135.7540359,34.81968769,,,職員室,,,
草内小学校,くさうちしょうがっこう,京田辺市草内南垣内５３,135.7856175,34.81180424,,,職員室,,,
桃園小学校,ももぞのしょうがっこう,京田辺市大住仲ノ谷１２−１,135.7456508,34.82553036,,,職員室,,,
三山木小学校,みやまぎしょうがっこう,京田辺市宮津宮ノ下４−３,135.7846067,34.79414665,,,職員室,,,
普賢寺小学校,ふげんじしょうがっこう,京田辺市水取門田６−１,135.7522621,34.78245403,,,職員室,,,
田辺東小学校,たなべひがししょうがっこう,京田辺市東西ノ口６０−２,135.7788046,34.82667533,,,職員室,,,
田辺中学校,たなべちゅうがっこう,京田辺市興戸北鉾立２１,135.7702978,34.81281283,,,職員室,,,
大住中学校,おおすみちゅうがっこう,京田辺市大住池平２,135.74117,34.83488935,,,職員室,,,
培良中学校,ばいりょうちゅうがっこう,京田辺市東七反割３,135.7843826,34.82060736,,,職員室,,,
田辺中央体育館,たなべちゅうおうたいいくかん,京田辺市田辺丸山１９,135.7664297,34.81513485,,,玄関付近,,,
田辺公園プール,たなべこうえんぷーる,京田辺市田辺丸山８,135.7655627,34.81450484,,,事務所,,,
水道部事業所,すいどうぶじぎょうしょ,京田辺市興戸犬伏１８−１,135.7716948,34.81338782,,,玄関付近,,,
新田辺駅東自転車駐車場,しんたなべえきひがしじてんしゃちゅうしゃじょう,京田辺市河原食田１０番地８０・８１,135.7732352,34.82163959,,,事務所付近,,,
ＪＲ三山木駅南北自転車駐車場,JRみやまぎえきなんぼくじてんしゃちゅうしゃじょう,京田辺市三山木柳ヶ町４−１,135.7842919,34.79864657,,,事務所付近,,,
ＪＲ京田辺駅西自転車駐車場,JRきょうたなべえきにしじてんしゃちゅうしゃじょう,京田辺市田辺久戸２−４,135.7683561,34.82101612,,,事務所付近,,,
京丹後市役所,きょうたんごしやくしょ,京丹後市峰山町杉谷８８９,135.0609859,35.62424467,,,１階正面玄関付近,,,
京丹後市大宮庁舎,きょうたんごしおおみやちょうしゃ,京丹後市大宮町口大野２２６,135.0958724,35.5834981,,,２階正面玄関付近,,,
京丹後市丹後庁舎,きょたんごしたんごちょうしゃ,京丹後市丹後町間人１７８０,135.10205,35.74011155,,,１階正面玄関付近,,,
京丹後市弥栄庁舎,きょたんごしやさかちょうしゃ,京丹後市弥栄町溝谷３４５０,135.0917141,35.65859017,,,１階正面玄関付近,,,
京丹後市久美浜庁舎,きょたんごしくみはまちょうしゃ,京丹後市久美浜町８１４,134.8950288,35.60342449,,,１階正面玄関付近,,,
ら・ぽーと,らぽーと,京丹後市網野町網野３８５−１,135.0257302,35.68215509,,,１階正面玄関付近,,,
峰山総合福祉センター,みねやまそうごうふくしせんたー,京丹後市峰山町杉谷６９１,135.0608053,35.62495253,,,１階正面玄関付近,,,
やさか老人保健施設ふくじゅ,やさかろうじんふくししせつふくじゅ,京丹後市弥栄町溝谷５４２２−１,135.0896221,35.65788214,,,２階ナースステーション内,,,
市立佐濃デイサービスセンター,しりつさのでいさーびすせんたー,京丹後市久美浜町竹藤４０,134.9614535,35.59442989,,,事務所内,,,
峰山保育所,みねやまほいくしょ,京丹後市峰山町杉谷２８３,135.0633644,35.62294795,,,職員室内,,,
吉原保育所,よしわらほいくしょ,京丹後市峰山町菅２２８,135.0579392,35.61116711,,,職員室内,,,
五箇保育所,ごかほいくしょ,京丹後市峰山町五箇２,135.0373969,35.58971313,,,職員室内,,,
長岡保育所,ながおかほいくしょ,京丹後市峰山町長岡９３,135.0701095,35.60303445,,,玄関,,,
新山保育所,しんざんほいくしょ,京丹後市峰山町荒山１２３１,135.0841586,35.61338313,,,職員室内,,,
丹波保育所,たんばほいくしょ,京丹後市峰山町丹波１４０３,135.0727852,35.63230401,,,玄関,,,
口大野保育所,くちおおのほいくしょ,京丹後市大宮町口大野６２５,135.0910984,35.58351312,,,職員室内,,,
大宮南保育所,おおみやみなみほいくしょ,京丹後市大宮町周枳１６７,135.1013753,35.58210989,,,職員室内,,,
河辺保育所,こうべほいくしょ,京丹後市大宮町河辺２３４２,135.089884,35.60393039,,,職員室前ホール,,,
善王寺保育所,ぜんのうじほいくしょ,京丹後市大宮町善王寺１０５８,135.0798735,35.59384753,,,職員室内,,,
網野保育所,あみのほいくしょ,京丹後市網野町網野７２１,135.0264901,35.68367349,,,職員室内,,,
網野みなみ保育所,あみのみなみほいくしょ,京丹後市網野町小浜１３３,135.0299412,35.67055102,,,職員室内,,,
浅茂川保育所,あさもがわほいくしょ,京丹後市網野町浅茂川１４,135.0207304,35.68555976,,,職員室内,,,
島津保育所,しまずほいくしょ,京丹後市網野町島津１１８０,135.050528,35.68399707,,,職員室内,,,
たちばな保育所,たちばなほいくしょ,京丹後市網野町木津１３５７−３,134.9675711,35.65380089,,,職員室内,,,
丹後保育所,たんごほいくしょ,京丹後市丹後町間人３００,135.0989197,35.72818511,,,職員室内,,,
宇川保育所,うかわほいくしょ,京丹後市丹後町中野２４２,135.1630768,35.74365873,,,職員室内,,,
和田野保育所,わだのほいくしょ,京丹後市弥栄町和田野１０２５,135.086571,35.66042416,,,職員室内,,,
鳥取保育所,とっとりほいくしょ,京丹後市弥栄町木橋２５,135.0767583,35.67388099,,,職員室内,,,
黒部保育所,くろべほいくしょ,京丹後市弥栄町黒部２８８０,135.0993609,35.67973999,,,職員室内,,,
溝谷保育所,みぞたにほいくしょ,京丹後市弥栄町堤３４３５,135.0944901,35.65646814,,,職員室内,,,
吉野保育所,よしのほいくしょ,京丹後市弥栄町芋野１２１３,135.0898961,35.64701623,,,職員室内,,,
久美浜保育所,くみはまほいくしょ,京丹後市久美浜町１３２２,134.8918698,35.60333356,,,職員室内,,,
湊保育所,みなとほいくしょ,京丹後市久美浜町湊宮２１０２−１,134.9110223,35.64351505,,,職員室内,,,
神野保育所,かんのほいくしょ,京丹後市久美浜町浦明１０５０,134.9242313,35.62560081,,,職員室前ホール,,,
田村保育所,たむらほいくしょ,京丹後市久美浜町関６２１,134.9446305,35.62071091,,,職員室内,,,
こうりゅう保育所,こうりゅうほいくしょ,京丹後市久美浜町永留２４６−４,134.941426,35.58907619,,,職員室内,,,
吉原小学校,よしわらしょうがっこう,京丹後市峰山町安９,135.0546202,35.61718001,,,１階職員室内,,,
五箇小学校,ごかしょうがっこう,京丹後市峰山町五箇１,135.0363939,35.59077718,,,１階職員室内,,,
大宮第二小学校,おみやだいに しょうがっこう,京丹後市大宮町奥大野７２,135.0888062,35.56533765,,,１階職員室内,,,
大宮第三小学校,おみやだいさんしょうがっこう,京丹後市大宮町森本７８２,135.1350926,35.5889642,,,１階職員室内,,,
三津小学校,みつしょうがっこう,京丹後市網野町三津２７,135.0664486,35.70592127,,,１階職員室内,,,
橘小学校,たちばなしょうがっこう,京丹後市網野町木津１３５７,134.9666493,35.65531199,,,１階職員室内,,,
宇川小学校,うかわしょうがっこう,京丹後市丹後町上野１２０,135.1725509,35.75206997,,,１階職員室内,,,
野間小学校,のましょうがっこう,京丹後市弥栄町野中２２６４,135.1570528,35.68527809,,,１階児童昇降口,,,
川上小学校,かわかみしょうがっこう,京丹後市久美浜町畑３９４,134.9322721,35.55612566,,,１階職員室内,,,
田村小学校,たむらしょうがっこう,京丹後市久美浜町関４９５,134.9455972,35.6203565,,,１階職員室内,,,
湊小学校,みなとしょうがっこう,京丹後市久美浜町湊宮１６５５,134.9022634,35.64271321,,,１階職員室内,,,
佐濃小学校,さのしょうがっこう,京丹後市久美浜町安養寺５８１,134.9618318,35.5815488,,,１階職員室内,,,
峰山中学校,みねやまちゅうがっこう,京丹後市峰山町荒山８８,135.0733626,35.61954338,,,１階職員室内,,,
大宮中学校,おおみやちゅうがっこう,京丹後市大宮町口大野２１６,135.0967254,35.58241206,,,１階職員室内,,,
宇川中学校,うかわちゅうがっこう,京丹後市丹後町上野１０５−１,135.1698613,35.75039389,,,１階校長室内,,,
間人中学校,たいざちゅうがっこう,京丹後市丹後町間人３２０,135.0971761,35.73093696,,,１階職員玄関,,,
網野中学校,あみのちゅうがっこう,京丹後市網野町網野２６９６,135.0324968,35.68509851,,,１階職員室内,,,
橘中学校,たちばなちゅうがっこう,京丹後市網野町木津１３５７,134.9664201,35.6563772,,,１階職員室内,,,
久美浜中学校,くみはまちゅうがっこう,京丹後市久美浜町６４０,134.895144,35.60148238,,,１階職員室内,,,
高龍中学校,こうりゅうちゅうがっこう,京丹後市久美浜町新谷２５０,134.937548,35.57766432,,,１階職員玄関,,,
市役所本庁,しやくしょほんちょう,南丹市園部町小桜町４７,135.4698667,35.10712857,,,１号庁舎１階市民課カウンター前,,,
南丹市役所八木支所,なんたんしやくしょやぎししょ,南丹市八木町八木東久保２９−１,135.532234,35.07062268,,,１号庁舎１階市民課カウンター前,,,
南丹市役所日吉支所,なんたんしやくしょひよしししょ,南丹市日吉町保野田市野３−１,135.5015975,35.16447516,,,２階ロビー,,,
南丹市役所美山支所,なんたんしやくしょみやまししょ,南丹市美山町島島台５１,135.5499565,35.27213378,,,２階ロビー正面,,,
宮島振興会,みやじましんこうかい,南丹市美山町島往古瀬２９,135.5509955,35.27214278,,,玄関入口,,,
大野振興会,おおのしんこうかい,南丹市美山町大野広畑１−２,135.5124487,35.27805294,,,玄関入った所,,,
平屋振興会,ひらやしんこうかい,南丹市美山町安掛下２５,135.5870987,35.27589709,,,事務所内　入口の右手,,,
知井振興会,ちいしんこうかい,南丹市美山町中上前８３,135.6389764,35.31188615,,,入口左側(男子便所入口と女子便所入口の間）,,,
鶴ケ岡振興会,つるがおかしんこうかい,南丹市美山町鶴ヶ岡新釈迦堂前１,135.5572872,35.32215017,,,玄関入った正面,,,
南丹市園部公民館,なんたんしそのべこうみんかん,南丹市園部町上本町南２−２２,135.4704598,35.10919259,,,１ 階ロビー　公衆電話横,,,
南丹市八木公民館,なんたんしやぎこうみんかん,南丹市八木町八木東久保２３,135.532689,35.07100404,,,１ 階ロビー　公衆電話横,,,
南丹市国際交流会館,なんたんしこくさいこうりゅうかいかん,南丹市園部町小桜町６２−１,135.4708208,35.10668058,,,１階ロビー,,,
南丹市日吉町生涯学習センター,なんたんしひよしちょうしょうがいがくしゅうせんたー,南丹市日吉町保野田長通２４,135.4894355,35.18040219,,,１階エントランス受付窓口横,,,
日吉駅交流センター,ひよしえきこうりゅうせんたー,南丹市日吉町保野田市野１−４,135.5029664,35.16264726,,,日吉駅　交流センター内待合室,,,
南丹市日吉胡麻コミュニティセンター,なんたんしひよしごまこみゅにてぃーせんたー,南丹市日吉町胡麻的場１−２,135.4685881,35.19541052,,,胡麻屋店内　コンコース側入口から入ったところ,,,
南丹市園部南部コミュニティセンター,なんたんしそのべなんぶこみゅにてぃーせんたー,南丹市園部町城南町クゴ３,135.4670662,35.10016823,,,１階　玄関前,,,
スプリングスひよし,すぷりんぐすひよし,南丹市日吉町中宮ノ向８,135.5178622,35.15195987,,,Å棟（レストラン側）エントランスホール、インフォメーション,,,
スプリングスひよし,すぷりんぐすひよし,南丹市日吉町中宮ノ向８,135.5162056,35.15280296,,,Ｂ棟（温泉側）フロント前、リラクゼーション横,,,
南丹市園部公園多目的運動場,なんたんしそのべこうえんたもくてきうんどうひろば,南丹市園部町小桜町南丹市園部公園内,135.4677335,35.10639654,,,玄関ロビー,,,
南丹市日吉山の家,なんたんしひよしやまのいえ,南丹市日吉町生畑ツノ元下１６　外,135.5468341,35.18447265,,,玄関ホール,,,
南丹市美山芦生山の家,なんたんしみやまあしゅうやまのいえ,南丹市美山町芦生須後１３,135.7140545,35.31054221,,,玄関入ったところ,,,
南丹市美山町自然文化村,なんたんしみやまちょうしぜんぶんかむら,南丹市美山町中下向５６　外,135.6392945,35.31063556,,,玄関入ったロビーの奥く(トイレの手前)、ロビーから見,,,
南丹市八木農村環境公園「氷室の郷」,なんたんしやぎのうそんかんきょうこうえんひむろのさと,南丹市八木町氷所赤見２１−１,135.5430241,35.09081288,,,玄関入って直のホール入口左側の壁,,,
南丹市美山江和長期滞在施設,なんたんしみやまえわちょうきたいざいしせつ,南丹市美山町江和下黒田１　外,135.6518799,35.31858034,,,（観光農園江和ランド）管理棟入口横,,,
道の駅(京都新光悦村),みちのえき(きょうとしんこうえつむら),南丹市園部町曽我谷縄手１５−３　外,135.4822195,35.1238575,,,店内南東奥壁前,,,
南丹市美山北加工・販売施設,なんたんしみやまきたかこうはんばいしせつ,南丹市美山町北揚石２８−１,135.6216267,35.31107952,,,玄関横通路,,,
南丹市園部スポーツセンター,なんたんしそのべすぽーつせんたー,南丹市園部町木崎町下ヲサ４９,135.475415,35.11430927,,,１階ロビー　玄関前,,,
南丹市八木海洋センター,なんたんしやぎかいようせんたー,南丹市八木町南広瀬泉６−１,135.5284983,35.07514928,,,１階　事務所内,,,
南丹市八木バイオエコロジーセンター,なんたんしやぎばいおえころじーせんたー,南丹市八木町諸畑千田１,135.5385299,35.09560203,,,会議室入口,,,
南丹市立八木中央幼児学園,なんたんしりつやぎちゅうおうようじがくえん,南丹市八木町西田河原條４２,135.5389461,35.07475955,,,玄関入口,,,
南丹市立八木東幼児学園,なんたんしりつやぎひがしようじがくえん,南丹市八木町北屋賀焼石８−３,135.5530271,35.07296085,,,玄関,,,
南丹市立園部幼稚園,なんたんしりつそのべようちえん,南丹市園部町小桜町４４,135.4696688,35.10805556,,,１階　職員室内（入口横）,,,
南丹市立園部保育所,なんたんしりつそのべほいくしょ,南丹市園部町木崎町下ヲサ４６,135.4758861,35.11424019,,,正面玄関　下駄箱前,,,
南丹市立城南保育所,なんたんしりつじょうなんほいくしょ,南丹市園部町城南町中井５０,135.4676165,35.10200445,,,玄関,,,
南丹市立日吉中央保育所,なんたんしりつひよしちゅうおうほいくしょ,南丹市日吉町保野田垣ノ内１１・１２　１合地,135.5012289,35.16476877,,,正面玄関,,,
南丹市立興風保育所,なんたんしりつこうふうほいくしょ,南丹市日吉町田原渕谷口２６−２,135.5197919,35.19075232,,,２階　職員室前,,,
南丹市立胡麻保育所,なんたんしりつごまほいくしょ,南丹市日吉町胡麻中野辺谷７３,135.4648682,35.20087358,,,玄関ロビー,,,
南丹市立みやま保育所,なんたんしりつみやまほいくしょ,南丹市美山町島島台５３,135.5493425,35.2730678,,,職員室内,,,
南丹市立知井保育所,なんたんしりつちいほいくしょ,南丹市美山町中勘定７,135.6430674,35.31354816,,,幼児玄関,,,
南丹市立園部小学校,なんたんしりつそのべしょうがっこう,南丹市園部町小桜町２６−２,135.4686387,35.10916956,,,１階玄関入口（屋内）,,,
南丹市立園部第二小学校,なんたんしりつそのべだいにしょうがっこう,南丹市園部町小山東町平成台２号７８　外,135.484717,35.09527873,,,１階　職員室前廊下,,,
南丹市立川辺小学校,なんたんしりつかわべしょうがっこう,南丹市園部町船岡長畑５２−３,135.4942278,35.13167404,,,１階　体育館入口,,,
南丹市立摩気小学校,なんたんしりつまけしょうがっこう,南丹市園部町宍人市場１１１,135.4409505,35.08992144,,,体育館入口横,,,
南丹市立西本梅小学校,なんたんしりつにしほんめしょうがっこう,南丹市園部町南八田中山１７,135.4330177,35.06148542,,,体育館の玄関内,,,
南丹市立八木小学校,なんたんしりつやぎしょうがっこう,南丹市八木町八木東所１５,135.5316061,35.06718761,,,正面玄関,,,
南丹市立富本小学校,なんたんしりつとみもとしょうがっこう,南丹市八木町青戸馬垣内１３−１,135.5471251,35.07845873,,,正面玄関前,,,
南丹市立新庄小学校,なんたんしりつしんじょうしょうがっこう,南丹市八木町船枝才ノ上４８,135.5228469,35.10523676,,,１階　職員玄関,,,
南丹市立吉富小学校,なんたんしりつよしとみしょうがっこう,南丹市八木町鳥羽鳥栄本１１,135.511492,35.0881951,,,管理棟１階玄関,,,
南丹市立神吉小学校,なんたんしりつかみよししょうがっこう,南丹市八木町神吉西河原１５,135.5856746,35.10774158,,,玄関内左側,,,
南丹市立殿田小学校,なんたんしりつとのだしょうがっこう,南丹市日吉町殿田大貝２５　外,135.5057954,35.16112837,,,１階玄関前（入って左手）,,,
南丹市立胡麻郷小学校,なんたんしりつごまごうしょうがっこう,南丹市日吉町胡麻中野辺谷３−３　外,135.4651291,35.19944353,,,管理特別教室棟,,,
南丹市立知井小学校,なんたんしりつちいしょうがっこう,南丹市美山町中穴原８,135.6441167,35.31320159,,,昇降口　廊下（体育館通路入口付近）,,,
南丹市立平屋小学校,なんたんしりつひらやしょうがっこう,南丹市美山町安掛上ノ山１７,135.5897212,35.27996738,,,１階玄関左手,,,
南丹市立宮島小学校,なんたんしりつみやじましょうがっこう,南丹市美山町島島台５２,135.5486275,35.27219274,,,正面玄関,,,
南丹市立鶴ヶ岡小学校,なんたんしりつつるがおかしょうがっこう,南丹市美山町鶴ヶ岡宮ノ前２３−２,135.5588222,35.32055216,,,職員玄関横内側（入口）,,,
南丹市立大野小学校,なんたんしりつおおのしょうがっこう,南丹市美山町三埜南畑２８,135.5034768,35.27348491,,,正面玄関入口,,,
南丹市立園部中学校,なんたんしりつそのべちゅうがっこう,南丹市園部町横田３号５１,135.4647387,35.10812359,,,職員玄関横,,,
南丹市立八木中学校,なんたんしりつやぎちゅうがっこう,南丹市八木町八木野條１,135.529594,35.072835,,,本館　玄関横,,,
南丹市立殿田中学校,なんたんしりつとのだちゅうがっこう,南丹市日吉町殿田大貝３０　外,135.50688,35.15959079,,,玄関入口,,,
南丹市立美山中学校,なんたんしりつみやまちゅうがっこう,南丹市美山町静原桧野１０−１,135.5507555,35.27664477,,,本館１階　職員玄関入口,,,
木津川市役所本館,きずがわしやくしょ,木津川市木津南垣外１１０−９,135.8200719,34.73716501,,,１階ホール,,,
木津川市役所総務課,きずがわしやくしょそうむか,木津川市木津南垣外１１０−９,135.8200719,34.73716501,,,３階危機管理室,,,
木津川市役所北別館,きずがわしやくしょきたべっかん,木津川市木津南垣外１５−２,135.8204237,34.73776458,,,事務所,,,
木津川市山城支所,きずがわしやましろししょ,木津川市山城町上狛北的場３−１,135.8175655,34.74979108,,,正面玄関内,,,
木津川市加茂支所,きずがわしかもししょ,木津川市加茂町里南古田１５６,135.8663603,34.75198034,,,正面玄関奥,,,
南加茂台公民館,ながもだいこうみんかん,木津川市南加茂台５丁目２−３,135.8715025,34.73988084,,,玄関ホール,,,
中央交流会館,きずがわしちゅうおうこうりゅうかいかん,木津川市木津宮ノ内９２,135.8188102,34.73067784,,,受付前,,,
中央図書館,きずがわしちゅうおうとしょかん,木津川市木津町内垣外３６,135.8150322,34.73634682,,,受付横,,,
中央体育館,きずがわしちゅうおうたいいくかん,木津川市木津石塚１４７,135.8091053,34.7285076,,,１階入り口,,,
中央体育館,きずがわしちゅうおうたいいくかん,木津川市木津石塚１４７,135.8091053,34.7285076,,,１階事務所内,,,
加茂文化センター,かもぶんかせんたー,木津川市加茂町里南古田１５６,135.8660001,34.75132995,,,１階フロアー,,,
山城総合文化センター,やましろそうごうぶんかせんたー,木津川市山城町平尾前田２４,135.8121249,34.77594238,,,正面玄関ホール,,,
市民スポーツセンター,きずがわしみんすぽーつせんたー,木津川市木津田中前４０−１,135.8095753,34.73207354,,,１階入り口,,,
山城町森林公園,やましろちょうしんりんこうえん,木津川市山城町神童子三上山１,135.8544497,34.78311051,,,事務所内,,,
加茂青少年山の家,かもせいしょうねんやまのいえ,木津川市加茂町尻枝七辻１５−１,135.8694108,34.723686,,,玄関ホール,,,
やすらぎタウン山城プール,やすらぎたうんやましろぷーる,木津川市山城町椿井柳田２６,135.8157897,34.75709369,,,玄関ホール券売機横,,,
共同浴場いずみ湯,きょうどうよくじょういずみゆ,木津川市木津清水２８,135.8193372,34.7351119,,,ロビー,,,
共同浴場やすらぎの湯,きょうどうよくじょうやすらぎのゆ,木津川市加茂町北廣２５−２,135.8811095,34.76154017,,,玄関ホール,,,
加茂人権センター,かもじんけんせんたー,木津川市加茂町北小谷５５−２,135.8832271,34.76151761,,,玄関ホール,,,
山城保健センター,やましろほけんせんたー,木津川市山城町椿井北代１０２,135.8140231,34.76469323,,,正面玄関奥,,,
木津保健センター,きずほけんせんたー,木津川市木津清水２７−２４,135.8203683,34.73458983,,,事務所,,,
木津老人福祉センター,きずろうじんふくしせんたー,木津川市木津川端１９,135.8170858,34.73941596,,,玄関ホール,,,
相楽老人福祉センター,そうらくろうじんふくしせんたー,木津川市相楽台４丁目３,135.7956532,34.73246946,,,事務所,,,
木津川台小学校,きずがわだいしょうがっこう,木津川市木津川台２丁目４,135.7888184,34.74402626,,,体育館,,,
高の原小学校,たかのはらしょうがっこう,木津川市兜台４町目４‐１,135.7824701,34.72744361,,,体育館,,,
相楽台小学校,さがなかだいしょうがっこう,木津川市相楽台５丁目１７−１,135.7970948,34.72674439,,,体育館,,,
木津小学校,きずしょうがっこう,木津川市木津町内垣外９５,135.8161657,34.73717324,,,体育館,,,
相楽小学校,さがなかしょうがっこう,木津川市相楽清水１,135.8017394,34.7356432,,,体育館,,,
州見台小学校,くにみだいしょうがっこう,木津川市州見台１丁目３２,135.8240355,34.71756651,,,体育館,,,
梅美台小学校,うめみだいしょうがっこう,木津川市梅美台４丁目２６−１,135.840283,34.7165864,,,体育館,,,
南加茂台小学校,ながもだいしょうがっこう,木津川市南加茂台１２丁目１１,135.8715402,34.73546897,,,正面玄関ホール,,,
棚倉小学校,たなくらしょうがっこう,木津川市山城町綺田局塚１４,135.8112719,34.78245858,,,職員室前,,,
上狛小学校,かみこましょうがっこう,木津川市山城町上狛学校１,135.8184952,34.75332115,,,玄関,,,
恭仁小学校,くにしょうがっこう,木津川市加茂町例幣中切３１・３２,135.861447,34.7655064,,,玄関,,,
加茂小学校,かもしょうがっこう,木津川市加茂町里西上田１１−１,135.8665971,34.74815459,,,玄関ホール,,,
木津小学校鹿背山分校,きずしょうがっこうかせやまぶんこう,木津川市鹿背山鹿曲田７７,135.840273,34.74381919,,,教室内,,,
