AED設置場所名称,よみ,住所,経度,緯度,利用開始時間,利用終了時間,設置位置,注意事項,URL,備考
安詳小学校,あんしょうしょうがっこう,亀岡市篠町篠中北裏６８,135.6059514,35.00505488,,,１階玄関正面,,,
東別院小学校,ひがしべついんしょうがっこう,亀岡市東別院町東掛岩脇９,135.5507425,34.9451204,,,１階保健室前,,,
西別院小学校,にしべついんしょうがっこう,亀岡市西別院町柚原佃２４,135.5095588,34.95227789,,,児童昇降口,,,
曽我部小学校,そかべしょうがっこう,亀岡市曽我部町南条中荒水代１,135.548585,34.99813153,,,１階職員室前廊下,,,
吉川小学校,よしかわしょうがっこう,亀岡市吉川町穴川平田１７,135.557079,35.01688801,,,１階職員室前廊下,,,
ひえ田野小学校,ひえだのしょうがっこう,亀岡市ひえ田野町佐伯源ノ坊１８,135.5330391,35.01857991,,,１階保健室前廊下,,,
本梅小学校,ほんめしょうがっこう,亀岡市本梅町井手早田垣内２３,135.4861712,35.01440933,,,玄関昇降口,,,
畑野小学校,はたのしょうがっこう,亀岡市畑野町千ヶ畑西山５,135.4308751,35.01495186,,,１階保健室前,,,
青野小学校,あおのしょうがっこう,亀岡市宮前町宮川青野２９,135.4849487,35.04625982,,,体育館スロープ入口,,,
大井小学校,おおいしょうがっこう,亀岡市大井町並河１−３−１,135.5566811,35.03128857,,,本館玄関階段踊り場,,,
千代川小学校,ちよかわしょうがっこう,亀岡市千代川町北ノ庄国主ヶ森２１,135.5434627,35.04807915,,,１階職員室後方入口右側,,,
川東小学校,かわひがししょうがっこう,亀岡市馬路町野堀１−７,135.5648424,35.05964282,,,１階校長室前,,,
保津小学校,ほずしょうがっこう,亀岡市保津町構ノ内２０,135.5903457,35.02411749,,,１階職員室横,,,
つつじヶ丘小学校,つつじがおかしょうがっこう,亀岡市西つつじヶ丘霧島台１−１,135.5885415,34.99980675,,,１階児童昇降口横,,,
城西小学校,じょうせいしょうがっこう,亀岡市余部町前川原４６,135.5720498,35.01571213,,,玄関昇降口横,,,
詳徳小学校,しょうとくしょうがっこう,亀岡市篠町柏原田中３−１,135.5943431,35.00719296,,,保健室前廊下,,,
南つつじヶ丘小学校,みなみつつじがおかしょうがっこう,亀岡市南つつじヶ丘大葉台２−２８−１,135.5901976,34.99282229,,,体育館入口,,,
亀岡中学校,かめおかちゅうがっこう,亀岡市内丸町１３,135.5804082,35.01165949,,,１階職員室前踊り場職員玄関横,,,
別院中学校,べついんちゅうがっこう,亀岡市東別院町南掛一ノ坪１,135.5324294,34.94623475,,,１階職員室,,,
南桑中学校,なんそうちゅうがっこう,亀岡市ひえ田野町太田丸橋１,135.5472824,35.02253801,,,職員室前,,,
育親中学校,いくしんちゅうがっこう,亀岡市本梅町中野和田山１−２,135.4869122,35.02860448,,,職員室横廊下,,,
高田中学校,たかだちゅうがっこう,亀岡市馬路町溝ノ上１４−４,135.5652353,35.05870004,,,体育館入口玄関,,,
東輝中学校,とうきちゅうがっこう,亀岡市篠町広田３−２８−１,135.5937428,34.9946018,,,１階職員玄関,,,
大成中学校,たいせいちゅうがっこう,亀岡市大井町土田１−５−７,135.5508752,35.03837513,,,１階生徒昇降口横,,,
詳徳中学校,しょうとくちゅうがっこう,亀岡市篠町柏原中又７,135.5955256,35.00664124,,,２階職員室,,,
城陽市役所,じょうようしやくしょ,城陽市寺田東ノ口１６、１７,135.7800593,34.85299198,,,本庁舎１階福祉課横,,,
消防本部,しょうぼうほんぶ,城陽市富野久保田１−１,135.7797792,34.84647331,,,１階指令室内,,,
消防本部,しょうぼうほんぶ,城陽市富野久保田１−１,135.7797792,34.84647331,,,２階事務所内,,,
久津川消防分署,くつかわしょうぼうぶんしょ,城陽市平川横道29−1,135.777084,34.86309328,,,２階事務所内,,,
青谷消防分署,あおだにしょうぼうぶんしょ,城陽市中樋ノ上71−16,135.8034012,34.82954583,,,１階事務所内,,,
文化パルク城陽,ぶんかぱるく じょうよう,城陽市寺田今堀１,135.7733623,34.84913292,,,1階事務室前,,,
東部コミュ二ティセンター,とうぶこみゅにてぃーせんたー,城陽市寺田正道１５２,135.7805162,34.8584371,,,１階事務室前,,,
北部コミュ二ティセンター,ほくぶこみゅにてぃーせんたー,城陽市平川広田６７,135.7629953,34.86294232,,,１階事務室前,,,
南部コミュ二ティセンター,なんぶこみゅにてぃーせんたー,城陽市富野東田部７０−１,135.7812584,34.84161377,,,１階事務室前,,,
今池コミュ二ティセンター,いまいけこみゅにてぃーせんたー,城陽市枇杷庄知原１５−１,135.7691102,34.83911491,,,１階事務室前,,,
青谷コミュ二ティセンター,あおだにこみゅにてぃーせんたー,城陽市市辺五島７−１,135.8000941,34.82832585,,,１階事務室前,,,
城陽市総合運動公園,じょうよううんどうこうえん,城陽市寺田奥山１,135.8018305,34.85539627,,,市民体育館1階事務室内,,,
プラムイン城陽,ぷらむいんじょうよう,城陽市寺田大川原２４−４,135.7975275,34.85620422,,,１階売店前,,,
アイリスイン城陽,あいりすいんじょうよう,城陽市寺田大川原２６−８,135.7998058,34.85597478,,,１階ロビー,,,
城陽市男女共同参画支援センター（ぱれっとＪＯＹO）,じょうようだんじょきょうどうさんかくしえんせんたー（ぱれっとJOYO）,城陽市寺田林ノ口１１−１１４,135.7825892,34.85542515,,,1階事務室前,,,
保健センター,ほけんせんたー,城陽市富野久保田１−１,135.7798853,34.84615699,,,１階エレベーター前,,,
城陽市福祉センター,じょうようしふくしせんたー,城陽市寺田東ノ口１７,135.7794237,34.85289436,,,１階事務室前,,,
老人福祉センター　陽寿苑,ろうじんふくしせんたー　ようじゅえん,城陽市奈島川原口２０,135.7921262,34.82683684,,,１階事務室横,,,
老人福祉センター　陽幸苑,ろうじんふくしせんたー　ようこうえん,城陽市寺田乾出北５５,135.7687733,34.85596598,,,２階事務室横,,,
老人福祉センター　陽和苑,ろうじんふくしせんたー　ようわえん,城陽市平川大将軍２,135.7708206,34.86572427,,,１階事務室横,,,
老人福祉センター　陽東苑,ろうじんふくしせんたー　ようとうえん,城陽市久世芝ケ原１３１,135.783271,34.86090563,,,１階事務室横,,,
古川小学校,ふるかわしょうがっこう,城陽市上津屋境端５７,135.7591378,34.86425462,,,管理棟２階職員室前,,,
深谷小学校,ふかたにしょうがっこう,城陽市寺田深谷１１１−２,135.7897917,34.85820043,,,管理棟１階職員室前廊下,,,
寺田小学校,てらだしょうがっこう,城陽市寺田北山田２,135.7801961,34.85628916,,,管理棟１階職員室前廊下,,,
寺田南小学校,てらだみなみしょうがっこう,城陽市寺田新池２３−１,135.7819762,34.84881998,,,北棟１階職員室前廊下,,,
寺田西小学校,てらだにししょうがっこう,城陽市寺田西ノ口６５,135.7653768,34.85525117,,,管理棟２階職員室前廊下,,,
富野小学校,とのしょうがっこう,城陽市富野堀口１,135.7879807,34.83848053,,,管理棟２階職員室前廊下,,,
今池小学校,いまいけしょうがっこう,城陽市寺田大畔１７７−１,135.7713465,34.84516086,,,管理棟２階職員室前廊下,,,
久津川小学校,くつかわしょうがっこう,城陽市平川指月１,135.7738051,34.86407634,,,管理棟１階職員室前廊下,,,
久世小学校,くせしょうがっこう,城陽市久世芝ケ原１４３,135.7802956,34.86100298,,,管理棟１階職員室前廊下,,,
青谷小学校,あおだにしょうがっこう,城陽市中向河原１,135.8036011,34.82990882,,,管理棟１階職員室前廊下,,,
城陽中学校,じょうようちゅうがっこう,城陽市寺田北山田３５,135.7835181,34.85717011,,,管理棟２階職員室前,,,
西城陽中学校,にしじょうようちゅうがっこう,城陽市寺田乾出北８２,135.7654003,34.85615298,,,北校舎２階職員室内,,,
南城陽中学校,みなみじょうようちゅうがっこう,城陽市観音堂巽畑１７−４,135.7992872,34.83435283,,,管理棟１階職員室前廊下,,,
東城陽中学校,ひがしじょうようちゅうがっこう,城陽市久世上大谷２４,135.794626,34.86395967,,,特別教室棟２階職員室前廊下,,,
北城陽中学校,きたじょうようちゅうがっこう,城陽市平川長筬３３,135.7640752,34.86842495,,,管理棟２階職員室前廊下,,,
市役所庁舎本館,むこうしやくしょほんかん,向日市寺戸町中野２０,135.6983062,34.94874114,,,１階ロビー,,,
市役所庁舎西別館,むこうしやくしょにしべっかん,向日市寺戸町中野１７,135.6974732,34.94833511,,,１階ロビー,,,
向日消防署,むこうしょうぼうしょ,向日市寺戸町西ノ段９−８,135.7003632,34.94720912,,,１階玄関内,,,
向日市民会館,むこうしみんかいかん,向日市寺戸町中ノ段１７−１,135.7009361,34.94665414,,,玄関ロビー,,,
向日市福祉会館,むこうふくしかいかん,向日市寺戸町西野辺１−７,135.7001051,34.94827115,,,１階事務室内,,,
物集女公民館,もずめこうみんかん,向日市物集町中条２６,135.6945214,34.96209308,,,玄関ロビー,,,
寺戸公民館,てらどこうみんかん,向日市寺戸町初田１８,135.7027491,34.95256417,,,玄関ロビー,,,
森本公民館,もりもとこうみんかん,向日市森本町前田６−７,135.7090672,34.94700112,,,玄関ロビー,,,
鶏冠井公民館,かいでこうみんかん,向日市鶏冠井町御屋敷２６,135.706546,34.94399296,,,玄関ロビー,,,
上植野公民館,かみうえのこうみんかん,向日市上植野町西小路１５,135.7038828,34.93621665,,,実習室前,,,
向日コミュニティセンター,むこうこみゅにてぃーせんたー,向日市向日町南山３−３,135.7000069,34.94410581,,,１階事務室前,,,
西向日コミュニティセンター,にしむこうこみゅにてぃーせんたー,向日市上植野町御塔道７−５,135.7016709,34.93974495,,,１階事務室前,,,
向日市図書館,むこうしとしょかん,向日市寺戸町南垣内４０−１,135.6994501,34.94938916,,,１階階段登り口,,,
向日市民体育館,むこうしみんたいいくかん,向日市森本町小柳２３−１,135.712834,34.94607012,,,１階ロビー,,,
向日市民温水プール,むこうしおんすいぷーる,向日市鶏冠井町上古８−１,135.7129318,34.94402904,,,１階ロビー事務室前,,,
向日市民温水プール,むこうしおんすいぷーる,向日市鶏冠井町上古８−１,135.7129318,34.94402904,,,１階ロビー事務室内,,,
向日市健康増進センター,むこうしけんこうぞうしんせんたー,向日市鶏冠井町上古８−１,135.7130896,34.9444468,,,１階フロント前,,,
向日市健康増進センター,むこうしけんこうぞうしんせんたー,向日市鶏冠井町上古８−１,135.7130896,34.9444468,,,２階トレーニングルーム内,,,
向日市保健センター,むこうしほけんせんたー,向日市寺戸町東野辺３１,135.7043142,34.94740514,,,１階事務室受付横,,,
老人福祉センター桜の径,ろうじんふくしせんたーさくらのみち,向日市上植野町南開６６−１,135.704425,34.94114293,,,１階事務室横,,,
老人福祉センター琴の橋,ろうじんふくしせんたーことのはし,向日市寺戸町三ノ坪２０,135.7016093,34.95916838,,,１階事務室横,,,
勝山中学校,かつやまちゅうがっこう,向日市鶏冠井町楓畑２４,135.7016254,34.94259369,,,１階職員室内,,,
西ノ岡中学校,にしのおかちゅうがっこう,向日市物集女町吉田１,135.6983236,34.96733357,,,玄関ホール内,,,
寺戸中学校,てらどちゅうがっこう,向日市寺戸町蔵ノ町１,135.7053663,34.95895831,,,２階職員室内,,,
向陽小学校,こうようしょうがっこう,向日市向日町南山３,135.6994869,34.94371698,,,１階保健室内,,,
第２向陽小学校,だいにこうようしょうがっこう,向日市物集町南条７０,135.6954866,34.95768901,,,正面玄関ホール内,,,
第３向陽小学校,だいさんこうようしょうがっこう,向日市森本町下森本３０,135.7064421,34.94930313,,,正面玄関ホール内,,,
第４向陽小学校,だいよんこうようしょうがっこう,向日市寺戸町三ノ坪２０,135.7016093,34.95916838,,,正面玄関ホール内,,,
第５向陽小学校,だいごこうようしょうがっこう,向日市上植野町五ノ坪１,135.7109188,34.93689402,,,１階保健室内,,,
第６向陽小学校,だいろくこうようしょうがっこう,向日市寺戸町大牧２４,135.6912624,34.95380236,,,１階保健室西側通路,,,
第１保育所,だいいちほいくしょ,向日市向日町北山２１,135.6990899,34.94449893,,,１階職員室内,,,
第２保育所,だいにほいくしょ,向日市物集町南条６３−２,135.6960801,34.95778587,,,１階職員室内,,,
レイモンド向日保育園,れいもんどむこうほいくえん,向日市森本町石田13-3,135.7113825,34.94641785,,,事務室内,,,
第５保育所,だいごほいくしょ,向日市寺戸町三ノ坪１４,135.7026484,34.95892735,,,１階職員室内,,,
第６保育所,だいろくほいくしょ,向日市上植野町地田５−３,135.7102047,34.93868104,,,１階職員室内,,,
長岡京市役所,ながおかきょうしやくしょ,長岡京市開田１−１−１,135.6957811,34.92678339,,,南棟１階玄関ロビー,,,
長岡京市役所　分庁舎３,ながおかきょうしやくしょぶんちょうしゃ3,長岡京市開田３−３−３６,135.6950431,34.92569535,,,１階玄関内,,,
乙訓消防組合消防本部東分署,おとくにしょうぼうくみあいしょうぼうほんぶひがしぶんしょ,長岡京市神足芝本９,135.7059308,34.92195868,,,１階玄関内,,,
長岡京消防署,ながおかきょうしょうぼうしょ,長岡京市天神４−２−１,135.6887541,34.92762633,,,１階玄関内,,,
中央公民館,ちゅうおうこうみんかん,長岡京市天神４−１−１,135.6883821,34.92704635,,,１階玄関ロビー,,,
市立保健センター,しりつほけんせんたー,長岡京市今里北ノ町３９−５,135.6950913,34.93527441,,,１階玄関ロビー,,,
西山公園体育館,にしやまこうえんたいいくかん,長岡京市長法寺谷山１,135.6774102,34.93213127,,,１階玄関エントランスホール,,,
長岡京市スポーツセンター,ながおかきょうしすぽーつせんたー,長岡京市神足下八ノ坪１,135.7114922,34.91956596,,,玄関受付前,,,
多世代交流ふれあいセンター,たせだいこうりゅうふれあいせんたー,長岡京市長法寺谷山１３−１,135.6772392,34.93079735,,,１階玄関エントランスホール,,,
長岡公園,ながおかこうえん,長岡京市天神２丁目１０１−１０,135.6856216,34.92208894,,,テニス管理事務所１階受付前,,,
神足小学校,こたりしょうがっこう,長岡京市神足３−２−１,135.6969721,34.92282138,,,南校舎１階保健室内,,,
長法寺小学校,ちょうほうじしょうがっこう,長岡京市長法寺川原谷３１,135.6828502,34.92911635,,,１階職員室横保健室内,,,
長岡第三小学校,ながおかだいさんしょうがっこう,長岡京市今里４−５−１０,135.6890166,34.93738668,,,南校舎１階保健室内,,,
長岡第四小学校,ながおかだいよんしょうがっこう,長岡京市友岡１−２−４,135.6917201,34.91816239,,,本館１階保健室内,,,
長岡第五小学校,ながおかだいごしょうがっこう,長岡京市下海印寺東山１,135.6816055,34.92121451,,,南校舎１階保健室内,,,
長岡第六小学校,ながおかだいろくしょうがっこう,長岡京市長岡２−３−１,135.6902711,34.92896836,,,北校舎１階保健室内,,,
長岡第七小学校,ながおかだいななしょうがっこう,長岡京市今里北ノ町３５,135.6945318,34.93580488,,,１階北側保健室内,,,
長岡第八小学校,ながおかだいはちしょうがっこう,長岡京市勝竜寺２９−１,135.6997606,34.91471362,,,北校舎１階保健室内,,,
長岡第九小学校,ながおかだいきゅうしょうがっこう,長岡京市東神足２−１７−１,135.7030939,34.92047272,,,南校舎１階保健室内,,,
長岡第十小学校,ながおかだいじゅうしょうがっこう,長岡京市井ノ内玉ノ上２２,135.6891573,34.94380475,,,南校舎１階保健室内,,,
長岡中学校,ながおかちゅうがっこう,長岡京市天神４−５−１,135.6871581,34.92788537,,,中校舎１階保健室内,,,
長岡第二中学校,ながおかだいにちゅうがっこう,長岡京市今里５−２０−１,135.6878428,34.93757749,,,南校舎１階保健室内,,,
長岡第三中学校,ながおかだいさんちゅうがっこう,長岡京市勝竜寺２８−１,135.6983808,34.91561655,,,中校舎１階保健室内,,,
長岡第四中学校,ながおかだいよんちゅうがっこう,長岡京市下海印寺西山田１−１,135.6782586,34.91729173,,,保健室内,,,
八幡市役所,やわたしやくしょ,八幡市園内７５,135.7076412,34.87554474,,,１階事務所西側通路,,,
八幡市第二分庁舎,やわたしだいにぶんちょうしゃ,八幡市八幡三本橋５９−９,135.7070753,34.87727567,,,１階玄関事務所,,,
八幡市民体育館,やわたしみんたいいくかん,八幡市野尻正畑１２,135.7437105,34.86276393,,,１階玄関,,,
市営南ヶ丘浴場,しえいみなみがおかよくじょう,八幡市八幡長田９７,135.7046071,34.86714563,,,待合室,,,
さつき市民プール,さつきしみんぷーる,八幡市男山笹谷１,135.6950416,34.87041731,,,管理事務所,,,
男山レクレーションセンター,おとこやまれくれしょんせんたー,八幡市八幡大谷８５−２１,135.6957644,34.87959663,,,事務所,,,
生涯学習センター,しょうがいがくしゅうせんたー,八幡市男山竹園２−３,135.6971056,34.85603046,,,１階玄関,,,
男山児童センター,おとこやまじどうせんたー,八幡市男山八望３−１,135.6985209,34.8628908,,,玄関,,,
指月児童センター,しげつじどうせんたー,八幡市男山指月３−１１,135.6960834,34.87027875,,,玄関,,,
竹園児童センター,たけぞのじどうせんたー,八幡市男山竹園２−６,135.6967816,34.85565148,,,玄関,,,
橋本児童センター,はしもとじどうせんたー,八幡市西山足立２８−１,135.6882374,34.87367976,,,職員室,,,
南ヶ丘児童センター,みなみがおかじどうせんたー,八幡市八幡軸２９−４,135.7056193,34.87024073,,,玄関,,,
都児童センター,みやこじどうせんたー,八幡市下奈良今里１７,135.7246465,34.87086063,,,玄関前通路,,,
老人憩いの家八寿園,ろうじんいこいのいえはちじゅえん,八幡市男山美桜１８,135.699768,34.8639352,,,事務所前大広間,,,
みその保育園,みそのほいくえん,八幡市八幡園内９２−１,135.7086002,34.87533366,,,玄関,,,
南ヶ丘保育園,みなみがおかほいくえん,八幡市八幡小松３３,135.70879,34.86729932,,,職員室,,,
南ヶ丘第二保育園,みなみがおかだいにほいくえん,八幡市八幡三反長１０,135.7077121,34.86482765,,,職員室,,,
みやこ保育園,みやこほいくえん,八幡市下奈良今里１７,135.7246465,34.87086063,,,職員室,,,
有都こども園,ゆうとこどもえん,八幡市内里北ノ口７,135.7277113,34.86395509,,,職員室,,,
わかたけ保育園,わかたけほいくえん,八幡市男山笹谷６−１,135.6990729,34.86513463,,,職員室,,,
さくら小学校,さくらしょうがっこう,八幡市男山美桜１７,135.6987082,34.86498164,,,保健室前通路,,,
中央小学校,ちゅうおうしょうがっこう,八幡市八幡小松７７,135.7088257,34.86949976,,,職員室,,,
橋本小学校,はしもとしょうがっこう,八幡市橋本中ノ池尻１５,135.6864164,34.8735788,,,職員室,,,
南山小学校,みなみやましょうがっこう,八幡市八幡南山７,135.7059594,34.85599756,,,職員室,,,
美濃山小学校,みのやましょうがっこう,八幡市欽明台西７０,135.7125723,34.84121565,,,職員室前廊下,,,
八幡小学校,やわたしょうがっこう,八幡市八幡菖蒲池１２,135.7052094,34.87840785,,,職員室前廊下,,,
くすのき小学校,くすのきしょうがっこう,八幡市男山金振９,135.6946555,34.85760429,,,職員室前廊下,,,
有都小学校,ゆうとしょうがっこう,八幡市内里北ノ山３１,135.7310451,34.8640551,,,職員玄関前,,,
男山東中学校,おとこやまひがしちゅうがっこう,八幡市内里砂畠１−１,135.7197969,34.85274934,,,職員玄関前,,,
男山中学校,おとこやまちゅうがっこう,八幡市八幡柿木垣内１８,135.7080551,34.87230876,,,２階西側職員室前通路,,,
男山第二中学校,おとこやまだいにちゅうがっこう,八幡市男山石城３,135.6977572,34.85997358,,,職員室前通路,,,
男山第三中学校,おとこやまだいさんちゅうがっこう,八幡市男山笹谷３,135.694289,34.86887289,,,職員玄関前,,,
京田辺市役所,きょうたなべしやくしょ,京田辺市田辺８０,135.7676988,34.81443285,,,正面玄関,,,
中央公民館,ちゅうおうこうみんかん,京田辺市田辺丸山２１４,135.7687708,34.81336986,,,ロビー,,,
天王公民館,てんのうざんこうみんかん,京田辺市天王下垣内４８,135.7375752,34.77971108,,,入り口付近,,,
打田公民館,うちだこうみんかん,京田辺市打田宮本４−１,135.7383571,34.75571498,,,入り口付近,,,
高船公民館,たかふねこうみんかん,京田辺市高船里５７,135.7325919,34.76932663,,,入り口付近,,,
中央図書館,ちゅうおうとしょかん,京田辺市田辺辻４０,135.7674557,34.82084312,,,正面玄関付近,,,
中部住民センター,ちゅうぶじゅうみんせんたー,京田辺市草内美泥２２−２,135.7878966,34.81886724,,,ロビー,,,
北部住民センター,ほくぶじゅうみんせんたー,京田辺市大住内山１−１,135.7417011,34.83559932,,,ロビー,,,
リサイクルプラザ,りさいくるぷらざ,京田辺市田辺茂ケ谷５８,135.7508822,34.80672837,,,入り口付近,,,
竜王野外活動センター,りゅうおうやがいかつどうせんたー,京田辺市大住竜王谷９−１,135.737657,34.82276986,,,ロビー,,,
保健センター,ほけんせんたー,京田辺市田辺７８,135.7683925,34.81457724,,,入り口付近,,,
社会福祉センター,しゃかいふくしせんたー,京田辺市興戸犬伏５−８,135.7723337,34.81302508,,,ロビー,,,
三山木福祉会館,みやまぎふくしかいかん,京田辺市三山木谷垣内６−１,135.7795068,34.79788137,,,ロビー,,,
常磐苑,ときわえん,京田辺市草内五ノ坪６,135.7829107,34.80668271,,,正面玄関,,,
宝生苑,ほうじょうえん,京田辺市大住内山７,135.7407281,34.83403631,,,正面玄関,,,
大住幼稚園,おおすみようちえん,京田辺市大住池平３２−４,135.7414851,34.83677198,,,職員室,,,
田辺東幼稚園,たなべひがしようちえん,京田辺市東西ノ口５１,135.7788466,34.82639234,,,職員室,,,
田辺幼稚園,たなべようちえん,京田辺市田辺鳥本７３,135.7683487,34.81717085,,,職員室,,,
草内幼稚園,くさうちようちえん,京田辺市草内南垣内５７−１,135.785743,34.81081461,,,職員室,,,
三山木幼稚園,みやまぎようちえん,京田辺市三山木南垣内４−１,135.7844455,34.79505337,,,職員室,,,
松井ケ丘幼稚園,まついがおかようちえん,京田辺市大住上西野２０−５,135.7359041,34.83598732,,,職員室,,,
薪幼稚園,たきぎようちえん,京田辺市薪大欠５１,135.7540369,34.82093005,,,職員室,,,
普賢寺幼稚園,ふげんじようちえん,京田辺市水取門田６−３,135.7522117,34.78295931,,,職員室,,,
河原保育所,かわらほいくしょ,京田辺市河原神谷６９,135.776728,34.82254376,,,職員室,,,
草内保育所,くさうちほいくしょ,京田辺市草内五反田２２−１,135.7821146,34.81476801,,,玄関入り口,,,
三山木保育所,みやまぎほいくしょ,京田辺市三山木南垣内３７,135.781978,34.79298715,,,職員室,,,
南山保育所,みなみやまほいくしょ,京田辺市三山木南山６３,135.7778649,34.79642336,,,職員室,,,
大住小学校,おおすみしょうがっこう,京田辺市大住池平８８,135.741255,34.83488277,,,職員室,,,
松井ケ丘小学校,まついがおかしょうがっこう,京田辺市大住上西野１８−２,135.7349292,34.83656828,,,職員室,,,
